{
  "generated_at": "2026-08-08",
  "pins": {
    "capec": {
      "entries_total": 615,
      "sha256": "70279a2dff0cb0ad79e546adb07828335a704ad5210e047e09e986172fc9e34d",
      "url": "https://capec.mitre.org/data/xml/capec_v3.9.xml",
      "version": "3.9"
    },
    "cwe": {
      "entries_active": 944,
      "entries_total": 969,
      "sha256": "3976f599e5e5200219a3108bb896d06e2a88fbb293369e1883cb423a5e9d7d50",
      "url": "https://cwe.mitre.org/data/xml/cwec_v4.20.xml.zip",
      "version": "4.20"
    }
  },
  "policy": {
    "advisory_feeds_are_dynamic": true,
    "generated_indexes_are_committed": true,
    "raw_inputs_are_temporary": true,
    "source_hashes_are_required": true
  },
  "project": "Secure Context Atlas",
  "release": "0.7.0",
  "repository_pins": {
    "awesome-bug-bounty": {
      "commit": "d63f5f44b41cc2dae0872fa50e211140838e2c87",
      "observed_at": "2026-08-08",
      "repository": "https://github.com/djadmin/awesome-bug-bounty.git",
      "url": "https://github.com/djadmin/awesome-bug-bounty"
    },
    "awesome-hacking": {
      "commit": "b2bb13aa69b4f568a1bab0cbb17b7a00a350dc36",
      "observed_at": "2026-08-08",
      "repository": "https://github.com/Hack-with-Github/Awesome-Hacking.git",
      "url": "https://github.com/Hack-with-Github/Awesome-Hacking"
    },
    "hacktricks": {
      "commit": "b4a826f21662ea383e31f510df5edcc13f20aff1",
      "observed_at": "2026-08-08",
      "repository": "https://github.com/HackTricks-wiki/hacktricks.git",
      "url": "https://github.com/HackTricks-wiki/hacktricks"
    },
    "patt": {
      "commit": "a9d97e9a57e901d7cebc865e3037ca27f009d71b",
      "observed_at": "2026-08-08",
      "repository": "https://github.com/swisskyrepo/PayloadsAllTheThings.git",
      "url": "https://github.com/swisskyrepo/PayloadsAllTheThings"
    },
    "seclists": {
      "commit": "03a61af885d5a724fe86ef8acc1df8771f77cd77",
      "observed_at": "2026-08-08",
      "repository": "https://github.com/danielmiessler/SecLists.git",
      "url": "https://github.com/danielmiessler/SecLists"
    }
  },
  "schema_version": "1.0"
}
